{ "schema": "alert.v1", "ts": "2026-10-14T10:42:21.310+05:30", "action": "RAISED",
  "alert": {
    "alert_id": "0192f1a4-7c41-7a10-8f00-1d2e3f4a5b6c", "ts": "2026-10-14T10:42:21.300+05:30",
    "machine_id": "EXC001", "operator_id": "OP1001", "shift_id": "SH-20261014-EXC001-D",
    "rule_id": "R03", "level": "CRITICAL", "subject": "EXIT",
    "state_snapshot": {"inputs": {"engine_state": "RUNNING", "seat_occupied": false, "seatbelt": "UNFASTENED",
                                  "door_open": true, "hyd_lockout": "UNLOCKED", "bucket_height_m": 2.1},
                       "thresholds": {"grounded_max_m": 0.3, "seat_vacated_s": 2}},
    "message_key": "nudge.exit_guard.before_exiting", "slots": {},
    "channels": ["VISUAL", "AUDIO", "VIBRATION"],
    "acknowledged_at": null, "ack_by": null, "suppressed": false, "suppress_reason": null,
    "escalated": false, "active": true, "cleared_at": null } }
